{
  "schema": "campaign_factory.caption_outcome_context.v1",
  "caption_hash": "caption_hash_rendered",
  "caption_text": "Hard launch energy.",
  "caption_bank": "launch_hooks",
  "caption_banks": ["launch_hooks"],
  "creator_mix": "Lola",
  "creator_model": "lola_v1",
  "frame_type": "mirror_selfie",
  "length_class": "short",
  "format_class": "reel",
  "caption_fit_version": "v1",
  "suitability_decision": "allowed",
  "suitability_reason": "frame_match",
  "captionSceneTags": ["general"],
  "reelSceneTags": ["bedroom_mirror"],
  "sceneCompatibilityDecision": "allowed",
  "sceneCompatibilityReason": "caption scene compatible with bedroom_mirror reel",
  "captionSceneFitVersion": "v1",
  "render_recipe": "reel_factory.preview.v1",
  "source_clip": "/tmp/source.mp4",
  "rendered_output": "/tmp/rendered.mp4"
}
